aiter/configs/model_configs/gptoss_bf16_tuned_gemm.csv
gfx,cu_num,M,N,K,bias,dtype,outdtype,scaleAB,bpreshuffle,libtype,solidx,splitK,us,kernelName,err_ratio,tflops,bw
gfx950,256,1,128,2880,True,torch.bfloat16,torch.bfloat16,False,False,asm,1,9,4.6262,_ZN5aiter39bf16gemm_fp32bf16_tn_32x64_splitk_cleanE,0.0078,0.16,160.67
gfx950,256,2,128,2880,True,torch.bfloat16,torch.bfloat16,False,False,asm,1,9,4.6019,_ZN5aiter39bf16gemm_fp32bf16_tn_32x64_splitk_cleanE,0.0156,0.32,162.83
gfx950,256,4,128,2880,True,torch.bfloat16,torch.bfloat16,False,False,asm,1,15,4.7202,_ZN5aiter39bf16gemm_fp32bf16_tn_32x64_splitk_cleanE,0.0137,0.62,161.29
gfx950,256,8,128,2880,True,torch.bfloat16,torch.bfloat16,False,False,asm,1,15,4.7061,_ZN5aiter39bf16gemm_fp32bf16_tn_32x64_splitk_cleanE,0.0273,1.25,166.89
gfx950,256,16,128,2880,True,torch.bfloat16,torch.bfloat16,False,False,asm,1,15,4.7651,_ZN5aiter39bf16gemm_fp32bf16_tn_32x64_splitk_cleanE,0.0273,2.48,174.93
gfx950,256,32,128,2880,True,torch.bfloat16,torch.bfloat16,False,False,flydsl,42,15,4.6463,flydsl_gemm2_abf16_wbf16_bf16_t32x64x64_split_k15_block_m_warp2_block_n_warp2_async_copyTrue_b_to_ldsTrue_b_preshuffleFalse_c_to_ldsFalse_gfx950,0.0237,5.08,200.11
gfx950,256,48,128,2880,True,torch.bfloat16,torch.bfloat16,False,False,flydsl,39,15,4.7651,flydsl_gemm2_abf16_wbf16_bf16_t32x64x64_split_k15_block_m_warp1_block_n_warp4_async_copyTrue_b_to_ldsFalse_b_preshuffleFalse_c_to_ldsFalse_gfx950,0.0262,7.43,215.33
gfx950,256,64,128,2880,True,torch.bfloat16,torch.bfloat16,False,False,flydsl,188,15,4.7406,flydsl_gemm2_abf16_wbf16_bf16_t32x64x64_split_k15_block_m_warp1_block_n_warp4_async_copyTrue_b_to_ldsTrue_b_preshuffleFalse_c_to_ldsFalse_gfx950,0.0243,9.95,236.74
gfx950,256,80,128,2880,True,torch.bfloat16,torch.bfloat16,False,False,flydsl,239,15,4.8623,flydsl_gemm2_abf16_wbf16_bf16_t32x64x64_split_k15_block_m_warp1_block_n_warp4_async_copyTrue_b_to_ldsFalse_b_preshuffleFalse_c_to_ldsFalse_gfx950,0.0253,12.13,250.61
gfx950,256,96,128,2880,True,torch.bfloat16,torch.bfloat16,False,False,flydsl,242,15,5.3055,flydsl_gemm2_abf16_wbf16_bf16_t32x64x64_split_k15_block_m_warp2_block_n_warp2_async_copyTrue_b_to_ldsTrue_b_preshuffleFalse_c_to_ldsFalse_gfx950,0.0247,13.34,247.82
gfx950,256,112,128,2880,True,torch.bfloat16,torch.bfloat16,False,False,flydsl,240,15,5.2015,flydsl_gemm2_abf16_wbf16_bf16_t32x64x64_split_k15_block_m_warp1_block_n_warp4_async_copyTrue_b_to_ldsTrue_b_preshuffleFalse_c_to_ldsFalse_gfx950,0.0246,15.88,271.28
gfx950,256,128,128,2880,True,torch.bfloat16,torch.bfloat16,False,False,flydsl,205,9,5.6343,flydsl_gemm2_abf16_wbf16_bf16_t16x64x64_split_k9_block_m_warp1_block_n_warp2_async_copyTrue_b_to_ldsFalse_b_preshuffleFalse_c_to_ldsFalse_gfx950,0.0177,16.75,267.53
gfx950,256,256,128,2880,True,torch.bfloat16,torch.bfloat16,False,False,flydsl,370,9,6.5478,flydsl_gemm2_abf16_wbf16_bf16_t32x64x64_split_k9_block_m_warp1_block_n_warp4_async_copyTrue_b_to_ldsFalse_b_preshuffleFalse_c_to_ldsFalse_gfx950,0.018,28.83,347.81
gfx950,256,1,2560,2880,True,torch.bfloat16,torch.bfloat16,False,False,flydsl,243,6,8.5347,flydsl_gemm2_abf16_wbf16_bf16_t16x64x160_split_k6_block_m_warp1_block_n_warp2_async_copyTrue_b_to_ldsFalse_b_preshuffleFalse_c_to_ldsFalse_small_m_gfx950,0.0141,1.73,1729.0
gfx950,256,2,2560,2880,True,torch.bfloat16,torch.bfloat16,False,False,flydsl,243,6,7.904,flydsl_gemm2_abf16_wbf16_bf16_t16x64x160_split_k6_block_m_warp1_block_n_warp2_async_copyTrue_b_to_ldsFalse_b_preshuffleFalse_c_to_ldsFalse_small_m_gfx950,0.0152,3.73,1868.34
gfx950,256,4,2560,2880,True,torch.bfloat16,torch.bfloat16,False,False,flydsl,245,15,7.9144,flydsl_gemm2_abf16_wbf16_bf16_t16x64x64_split_k15_block_m_warp1_block_n_warp2_async_copyTrue_b_to_ldsFalse_b_preshuffleFalse_c_to_ldsFalse_small_m_gfx950,0.0266,7.45,1868.63
gfx950,256,8,2560,2880,True,torch.bfloat16,torch.bfloat16,False,False,flydsl,245,15,8.2005,flydsl_gemm2_abf16_wbf16_bf16_t16x64x64_split_k15_block_m_warp1_block_n_warp2_async_copyTrue_b_to_ldsFalse_b_preshuffleFalse_c_to_ldsFalse_small_m_gfx950,0.0251,14.39,1808.75
gfx950,256,16,2560,2880,True,torch.bfloat16,torch.bfloat16,False,False,flydsl,268,9,8.614,flydsl_gemm2_abf16_wbf16_bf16_t16x64x64_split_k9_block_m_warp1_block_n_warp2_async_copyTrue_b_to_ldsFalse_b_preshuffleFalse_c_to_ldsFalse_small_m_gfx950,0.0182,27.39,1732.03
gfx950,256,32,2560,2880,True,torch.bfloat16,torch.bfloat16,False,False,asm,1,4,10.0478,_ZN5aiter39bf16gemm_fp32bf16_tn_32x64_splitk_cleanE,0.0099,46.96,1502.2
gfx950,256,48,2560,2880,True,torch.bfloat16,torch.bfloat16,False,False,asm,1,3,10.5933,_ZN5aiter39bf16gemm_fp32bf16_tn_32x64_splitk_cleanE,0.0073,66.81,1441.27
gfx950,256,64,2560,2880,True,torch.bfloat16,torch.bfloat16,False,False,asm,1,3,10.7011,_ZN5aiter39bf16gemm_fp32bf16_tn_32x64_splitk_cleanE,0.0074,88.19,1443.02
gfx950,256,128,2560,2880,True,torch.bfloat16,torch.bfloat16,False,False,asm,5,3,11.7861,_ZN5aiter39bf16gemm_fp32bf16_tn_64x64_splitk_cleanE,0.0074,160.14,1369.26
gfx950,256,256,2560,2880,True,torch.bfloat16,torch.bfloat16,False,False,asm,8,2,15.3912,_ZN5aiter39bf16gemm_fp32bf16_tn_96x64_splitk_cleanE,0.0041,245.26,1139.02
gfx950,256,1,2880,2048,True,torch.bfloat16,torch.bfloat16,False,False,flydsl,139,16,6.0968,flydsl_gemm2_abf16_wbf16_bf16_t16x192x128_split_k16_block_m_warp1_block_n_warp4_async_copyTrue_b_to_ldsTrue_b_preshuffleFalse_c_to_ldsFalse_small_m_wpe4_ur16_gfx950,0.0212,1.93,1936.48
gfx950,256,1,2880,4096,True,torch.bfloat16,torch.bfloat16,False,False,flydsl,388,16,8.3638,flydsl_gemm2_abf16_wbf16_bf16_t16x192x64_split_k16_block_m_warp1_block_n_warp4_async_copyTrue_b_to_ldsTrue_b_preshuffleFalse_c_to_ldsFalse_small_m_wpe2_ur8_gfx950,0.0316,2.82,2822.51
gfx950,256,2,2880,2048,True,torch.bfloat16,torch.bfloat16,False,False,flydsl,138,16,6.0853,flydsl_gemm2_abf16_wbf16_bf16_t16x192x128_split_k16_block_m_warp1_block_n_warp4_async_copyTrue_b_to_ldsTrue_b_preshuffleFalse_c_to_ldsFalse_small_m_wpe2_ur8_gfx950,0.0224,3.88,1941.76
gfx950,256,2,2880,4096,True,torch.bfloat16,torch.bfloat16,False,False,flydsl,139,16,8.2195,flydsl_gemm2_abf16_wbf16_bf16_t16x192x128_split_k16_block_m_warp1_block_n_warp4_async_copyTrue_b_to_ldsTrue_b_preshuffleFalse_c_to_ldsFalse_small_m_wpe4_ur16_gfx950,0.0269,5.74,2873.76
gfx950,256,4,2880,2048,True,torch.bfloat16,torch.bfloat16,False,False,flydsl,140,16,6.1308,flydsl_gemm2_abf16_wbf16_bf16_t16x192x128_split_k16_block_m_warp1_block_n_warp4_async_copyTrue_b_to_ldsTrue_b_preshuffleFalse_c_to_ldsFalse_small_m_wpe4_ur8_gfx950,0.0224,7.7,1930.56
gfx950,256,4,2880,4096,True,torch.bfloat16,torch.bfloat16,False,False,flydsl,138,16,8.2605,flydsl_gemm2_abf16_wbf16_bf16_t16x192x128_split_k16_block_m_warp1_block_n_warp4_async_copyTrue_b_to_ldsTrue_b_preshuffleFalse_c_to_ldsFalse_small_m_wpe2_ur8_gfx950,0.0292,11.42,2862.87
gfx950,256,8,2880,2048,True,torch.bfloat16,torch.bfloat16,False,False,flydsl,771,8,6.726,flydsl_gemm2_abf16_wbf16_bf16_t16x64x256_split_k8_block_m_warp1_block_n_warp2_async_copyTrue_b_to_ldsTrue_b_preshuffleFalse_c_to_ldsFalse_small_m_wpe4_ur8_gfx950,0.0161,14.03,1765.59
gfx950,256,8,2880,4096,True,torch.bfloat16,torch.bfloat16,False,False,flydsl,792,8,8.6182,flydsl_gemm2_abf16_wbf16_bf16_t16x64x256_split_k8_block_m_warp1_block_n_warp2_async_copyTrue_b_to_ldsTrue_b_preshuffleFalse_c_to_ldsFalse_small_m_ur16_gfx950,0.0195,21.9,2750.53
gfx950,256,16,2880,2048,True,torch.bfloat16,torch.bfloat16,False,False,flydsl,750,4,6.9944,flydsl_gemm2_abf16_wbf16_bf16_t16x64x256_split_k4_block_m_warp1_block_n_warp4_async_copyTrue_b_to_ldsFalse_b_preshuffleFalse_c_to_ldsFalse_small_m_gfx950,0.0103,26.98,1709.11
gfx950,256,16,2880,4096,True,torch.bfloat16,torch.bfloat16,False,False,flydsl,798,8,9.0841,flydsl_gemm2_abf16_wbf16_bf16_t16x64x256_split_k8_block_m_warp1_block_n_warp4_async_copyTrue_b_to_ldsFalse_b_preshuffleFalse_c_to_ldsFalse_small_m_gfx950,0.0205,41.55,2621.74
gfx950,256,32,2880,2048,True,torch.bfloat16,torch.bfloat16,False,False,flydsl,145,4,8.0743,flydsl_gemm2_abf16_wbf16_bf16_t32x64x256_split_k4_block_m_warp1_block_n_warp4_async_copyTrue_b_to_ldsFalse_b_preshuffleFalse_c_to_ldsFalse_gfx950,0.0104,46.75,1500.05
gfx950,256,32,2880,4096,True,torch.bfloat16,torch.bfloat16,False,False,flydsl,164,4,10.4391,flydsl_gemm2_abf16_wbf16_bf16_t32x64x256_split_k4_block_m_warp1_block_n_warp4_async_copyTrue_b_to_ldsFalse_b_preshuffleFalse_c_to_ldsFalse_gfx950,0.0132,72.32,2302.83
gfx950,256,48,2880,2048,True,torch.bfloat16,torch.bfloat16,False,False,flydsl,353,4,9.5624,flydsl_gemm2_abf16_wbf16_bf16_t64x64x256_split_k4_block_m_warp1_block_n_warp4_async_copyTrue_b_to_ldsFalse_b_preshuffleFalse_c_to_ldsFalse_gfx950,0.0103,59.21,1283.11
gfx950,256,48,2880,4096,True,torch.bfloat16,torch.bfloat16,False,False,asm,3,5,12.1652,_ZN5aiter39bf16gemm_fp32bf16_tn_48x64_splitk_cleanE,0.0136,93.09,1994.43
gfx950,256,64,2880,2048,True,torch.bfloat16,torch.bfloat16,False,False,asm,5,3,10.045,_ZN5aiter39bf16gemm_fp32bf16_tn_64x64_splitk_cleanE,0.0066,75.16,1237.16
gfx950,256,64,2880,4096,True,torch.bfloat16,torch.bfloat16,False,False,asm,5,5,12.6691,_ZN5aiter39bf16gemm_fp32bf16_tn_64x64_splitk_cleanE,0.0136,119.18,1932.73
gfx950,256,80,2880,4096,True,torch.bfloat16,torch.bfloat16,False,False,asm,7,5,12.8662,_ZN5aiter39bf16gemm_fp32bf16_tn_80x64_splitk_cleanE,0.0137,146.7,1920.47
gfx950,256,96,2880,4096,True,torch.bfloat16,torch.bfloat16,False,False,asm,8,5,13.1474,_ZN5aiter39bf16gemm_fp32bf16_tn_96x64_splitk_cleanE,0.0136,172.27,1896.37
gfx950,256,112,2880,4096,True,torch.bfloat16,torch.bfloat16,False,False,asm,5,2,17.299,_ZN5aiter39bf16gemm_fp32bf16_tn_64x64_splitk_cleanE,0.0048,152.75,1454.16
gfx950,256,128,2880,2048,True,torch.bfloat16,torch.bfloat16,False,False,asm,5,2,11.5282,_ZN5aiter39bf16gemm_fp32bf16_tn_64x64_splitk_cleanE,0.0035,130.98,1132.7
gfx950,256,128,2880,4096,True,torch.bfloat16,torch.bfloat16,False,False,asm,5,2,17.0438,_ZN5aiter39bf16gemm_fp32bf16_tn_64x64_splitk_cleanE,0.0048,177.18,1489.04
gfx950,256,256,2880,2048,True,torch.bfloat16,torch.bfloat16,False,False,asm,6,1,15.42,_ZN5aiter37bf16gemm_fp32bf16_tn_64x64_pf3_splitkE,0.0,195.84,928.64
gfx950,256,1,5120,2880,True,torch.bfloat16,torch.bfloat16,False,False,flydsl,247,9,10.4898,flydsl_gemm2_abf16_wbf16_bf16_t16x64x160_split_k9_block_m_warp1_block_n_warp2_async_copyTrue_b_to_ldsFalse_b_preshuffleFalse_c_to_ldsFalse_small_m_gfx950,0.0182,2.81,2812.94
gfx950,256,2,5120,2880,True,torch.bfloat16,torch.bfloat16,False,False,flydsl,247,9,9.6817,flydsl_gemm2_abf16_wbf16_bf16_t16x64x160_split_k9_block_m_warp1_block_n_warp2_async_copyTrue_b_to_ldsFalse_b_preshuffleFalse_c_to_ldsFalse_small_m_gfx950,0.0194,6.09,3049.38
gfx950,256,4,5120,2880,True,torch.bfloat16,torch.bfloat16,False,False,flydsl,271,9,10.2067,flydsl_gemm2_abf16_wbf16_bf16_t16x64x64_split_k9_block_m_warp1_block_n_warp2_async_copyTrue_b_to_ldsFalse_b_preshuffleFalse_c_to_ldsFalse_small_m_gfx950,0.0201,11.56,2895.67
gfx950,256,8,5120,2880,True,torch.bfloat16,torch.bfloat16,False,False,flydsl,271,9,11.2498,flydsl_gemm2_abf16_wbf16_bf16_t16x64x64_split_k9_block_m_warp1_block_n_warp2_async_copyTrue_b_to_ldsFalse_b_preshuffleFalse_c_to_ldsFalse_small_m_gfx950,0.0189,20.97,2632.86
gfx950,256,16,5120,2880,True,torch.bfloat16,torch.bfloat16,False,False,flydsl,271,9,11.9689,flydsl_gemm2_abf16_wbf16_bf16_t16x64x64_split_k9_block_m_warp1_block_n_warp2_async_copyTrue_b_to_ldsFalse_b_preshuffleFalse_c_to_ldsFalse_small_m_gfx950,0.0191,39.42,2485.37
gfx950,256,32,5120,2880,True,torch.bfloat16,torch.bfloat16,False,False,asm,1,3,12.2241,_ZN5aiter39bf16gemm_fp32bf16_tn_32x64_splitk_cleanE,0.0077,77.2,2454.43
gfx950,256,48,5120,2880,True,torch.bfloat16,torch.bfloat16,False,False,asm,3,3,12.9649,_ZN5aiter39bf16gemm_fp32bf16_tn_48x64_splitk_cleanE,0.0076,109.19,2333.93
gfx950,256,64,5120,2880,True,torch.bfloat16,torch.bfloat16,False,False,asm,5,3,13.6686,_ZN5aiter39bf16gemm_fp32bf16_tn_64x64_splitk_cleanE,0.0077,138.09,2232.5
gfx950,256,80,5120,2880,True,torch.bfloat16,torch.bfloat16,False,False,asm,7,3,13.957,_ZN5aiter39bf16gemm_fp32bf16_tn_80x64_splitk_cleanE,0.0076,169.04,2204.71
gfx950,256,96,5120,2880,True,torch.bfloat16,torch.bfloat16,False,False,asm,8,3,14.3466,_ZN5aiter39bf16gemm_fp32bf16_tn_96x64_splitk_cleanE,0.0076,197.34,2162.69
gfx950,256,112,5120,2880,True,torch.bfloat16,torch.bfloat16,False,False,asm,4,1,19.3332,_ZN5aiter37bf16gemm_fp32bf16_tn_48x64_pf3_splitkE,0.0,170.85,1618.11
gfx950,256,128,5120,2880,True,torch.bfloat16,torch.bfloat16,False,False,asm,4,1,19.5488,_ZN5aiter37bf16gemm_fp32bf16_tn_48x64_pf3_splitkE,0.0,193.1,1613.36
